{
  "schema": "verify.claim/v1.1",
  "actor": "claude",
  "task_id": "T_ci_test",
  "timestamp": "2024-01-15T12:05:00Z",
  "claim": {
    "type": "code",
    "units_total": 3,
    "units_list": ["file1.js", "file2.js", "file3.js"],
    "scope": {
      "repo_root": "/test",
      "files": ["file1.js", "file2.js", "file3.js"]
    },
    "declared": {
      "intent": "Test CI validation",
      "approach": "Create test artifacts",
      "completion_status": "complete"
    }
  }
}